{
  "$schema": "https://json-schema.org/draft/2020-12/schema",
  "$id": "reference_factory.higgsfield_soul_image_prompt.v1",
  "title": "Higgsfield Soul ID Image Prompt",
  "type": "object",
  "required": [
    "schema",
    "tool",
    "status",
    "sourceReferenceId",
    "sourcePatternId",
    "modelProfile",
    "mainPrompt",
    "negativePrompt",
    "closenessControls"
  ],
  "properties": {
    "schema": { "const": "reference_factory.higgsfield_soul_image_prompt.v1" },
    "tool": { "const": "higgsfield_soul_image" },
    "status": { "type": "string" },
    "sourceReferenceId": { "type": "string" },
    "sourcePatternId": { "type": "string" },
    "modelProfile": { "type": ["string", "null"] },
    "mainPrompt": { "type": "string" },
    "negativePrompt": { "type": "string" },
    "closenessControls": { "type": "object" },
    "formatCard": { "type": "object" },
    "aspectRatio": { "type": "string" },
    "reviewNotes": { "type": "array" }
  }
}
